{
  "aonid": 205,
  "edition": "remastered",
  "game-id": "2f57dfc10f8489b9b6ae318a31bd91a8",
  "game-obj": "Sources",
  "license": {
    "license": "Open RPG Creative license",
    "name": "ORC Notice",
    "sections": [
      {
        "name": "Attribution",
        "sections": [
          {
            "name": "Rage of Elements",
            "text": "<div> <b><i>Pathfinder Core Rulebook (Second Edition)</i></b> \u00a9 2019, Paizo Inc.; Authors: Logan Bonner, Jason Bulmahn, Stephen Radney-MacFarland, and Mark Seifter.<br/> <b><i>Pathfinder Rage of Elements</i></b> \u00a9 2023, Paizo Inc.; Authors: Logan Bonner, Jason Bulmahn, James Case, Jessica Catalan, Andrew D. Geels, Sen H.H.S., Patrick Hurley, Jason Keeley, Luis Loza, Mark Moreland, Jonathan Morgantini, AJ Neuro, Jessica Redekop, Solomon St. John, Michael Sayre, Mark Seifter, Shahreena Shahrani, Shay Snow, Levi Steadman, Mari Tokuda, Ruvaid Virk, Andrew White, and Linda Zayas-Palmer.    </div>",
            "type": "section"
          }
        ],
        "text": "This product is based on the following Licensed Material:",
        "type": "section"
      },
      {
        "name": "Attributing us",
        "sections": [
          {
            "name": "Pathfinder Open Reference",
            "text": "\u00a9 2023 Masterwork Tools LLC, Authors: Devon Jones, Monica Jones.",
            "type": "section"
          }
        ],
        "text": "If you use our Licensed Material in your own published works, please credit us as follows:",
        "type": "section"
      },
      {
        "name": "Reserved Material",
        "text": "Reserved Material elements in this product include, but may not be limited to: [none]",
        "type": "section"
      },
      {
        "name": "Expressly Designated Licensed Material",
        "text": "The following elements are owned by the Licensor and would otherwise constitute Reserved Material and are hereby designated as Licensed Material: [None].",
        "type": "section"
      }
    ],
    "subtype": "license",
    "text": "This product is licensed under the ORC License to be held in the Library of Congress and available online at various locations including paizo.com/orclicense, azoralaw.com/orclicense, and others. All warranties are disclaimed as set forth therein.",
    "type": "section"
  },
  "name": "Rage of Elements",
  "note": "These entries have been updated with errata released on 5/17/2024",
  "product_line": "Rulebooks",
  "release_date": "2023-08-02",
  "schema_version": 1.0,
  "type": "source"
}